Sheet,Game,Question,Category,Question Type,Options,Correct Answer,Active,Intensity,Tone,Relationship Area,Tags,Notes,Memory Lane Mode,Avoid If,Game Suitability,AI Use Case,Repeat Group,Default Answer Type,Answer Type,Unit Label,Scoring Divisor,Rounding Mode,Round Penalty Value,Fixed Penalty,Scoring Mode,Scoring Outcome Type,Source Label,Added By,Original Sheet,Original Question Type
Questions,Normal Game,Do you hate when people interrupt you?,Pet Peeves,Text Answer,,,1,4,savage,lifestyle,"savage, fun, lifestyle, general",,,argument-risk,"spicy-night, final-round",spicy-escalation,lifestyle,text,text,,,,,,,,,,,
Questions,Normal Game,What small thing can ruin your day?,Pet Peeves,Text Answer,,,1,2,playful,lifestyle,"fun, lifestyle, general",,,,"quick-fire, warm-up",funny-break,lifestyle,text,text,,,,,,,,,,,
Questions,Normal Game,"If you could have any animal as a pet, what would it be?",Random / Wildcard,Text Answer,,,1,2,playful,lifestyle,"fun, random, hypothetical, lifestyle",,,,"quick-fire, warm-up",funny-break,lifestyle,text,text,,,,,,,,,,,
Questions,Normal Game,What’s the last thing you Googled?,Random / Wildcard,Text Answer,,,1,2,playful,lifestyle,"fun, lifestyle, general",,,,"quick-fire, warm-up",funny-break,lifestyle,text,text,,,,,,,,,,,
Questions,Normal Game,Do you believe in aliens?,Random / Wildcard,Text Answer,,,1,2,playful,lifestyle,"fun, lifestyle, general",,,,"quick-fire, warm-up",funny-break,lifestyle,text,text,,,,,,,,,,,
Questions,Normal Game,What’s the weirdest food combination you enjoy?,Random / Wildcard,Text Answer,,,1,2,playful,lifestyle,"food, drink, lifestyle, fun",,,,"quick-fire, warm-up",funny-break,food-drink,text,text,,,,,,,,,,,
Questions,Normal Game,"If you could possess one mythical creature, which would you choose?",Random / Wildcard,Text Answer,,,1,2,playful,lifestyle,"fun, random, hypothetical, lifestyle",,,,"quick-fire, warm-up",funny-break,lifestyle,text,text,,,,,,,,,,,
Questions,Normal Game,What’s your hidden talent?,Random / Wildcard,Text Answer,,,1,2,playful,lifestyle,"fun, lifestyle, general",,,,"quick-fire, warm-up",funny-break,lifestyle,text,text,,,,,,,,,,,
Questions,Normal Game,"If you had to change your name, what would you pick?",Random / Wildcard,Text Answer,,,1,2,playful,lifestyle,"fun, lifestyle, general",,,,"quick-fire, warm-up",funny-break,lifestyle,text,text,,,,,,,,,,,
Questions,Normal Game,Do you believe in luck or fate?,Random / Wildcard,Text Answer,,,1,2,playful,lifestyle,"fun, lifestyle, general",,,,"quick-fire, warm-up",funny-break,lifestyle,text,text,,,,,,,,,,,
Questions,Normal Game,What’s a conspiracy theory you find fascinating?,Random / Wildcard,Text Answer,,,1,2,playful,lifestyle,"fun, lifestyle, general",,,,"quick-fire, warm-up",funny-break,lifestyle,text,text,,,,,,,,,,,
Questions,Normal Game,What’s the most random item in your bag right now?,Random / Wildcard,Text Answer,,,1,2,playful,lifestyle,"fun, lifestyle, general",,,,"quick-fire, warm-up",funny-break,lifestyle,text,text,,,,,,,,,,,
Questions,Normal Game,"If you had a personal mascot, what would it be?",Random / Wildcard,Text Answer,,,1,2,playful,lifestyle,"fun, lifestyle, general",,,,"quick-fire, warm-up",funny-break,lifestyle,text,text,,,,,,,,,,,
Questions,Normal Game,What’s the most unusual gift you’ve ever received?,Random / Wildcard,Text Answer,,,1,2,playful,lifestyle,"fun, lifestyle, general",,,,"quick-fire, warm-up",funny-break,lifestyle,text,text,,,,,,,,,,,
Questions,Normal Game,Do you have any phobias?,Random / Wildcard,Text Answer,,,1,2,playful,lifestyle,"fun, lifestyle, general",,,,"quick-fire, warm-up",funny-break,lifestyle,text,text,,,,,,,,,,,
Questions,Normal Game,"If you could have a theme song play every time you entered a room, what would it be?",Random / Wildcard,Text Answer,,,1,2,playful,lifestyle,"entertainment, fun, random, hypothetical, lifestyle",,,,"quick-fire, warm-up",funny-break,entertainment,text,text,,,,,,,,,,,
Questions,Normal Game,What’s your favorite board game?,Random / Wildcard,Text Answer,,,1,2,competitive,lifestyle,"entertainment, sports, fun, lifestyle",,,,"quick-fire, warm-up",escalation,entertainment,text,text,,,,,,,,,,,
Questions,Normal Game,"If you could instantly become fluent in one fictional language, which would it be?",Random / Wildcard,Text Answer,,,1,2,playful,lifestyle,"fun, random, hypothetical, lifestyle",,,,"quick-fire, warm-up",funny-break,lifestyle,text,text,,,,,,,,,,,
Questions,Normal Game,What’s a habit you picked up recently?,Random / Wildcard,Text Answer,,,1,3,playful,habits,"personality, habits, fun, lifestyle",,,,"date-night, normal",deep-connection,habits,text,text,,,,,,,,,,,
Questions,Normal Game,"If you could swap lives with someone for a day, who would it be?",Random / Wildcard,Text Answer,,,1,2,playful,lifestyle,"fun, random, hypothetical, lifestyle",,,,"quick-fire, warm-up",funny-break,lifestyle,text,text,,,,,,,,,,,
Questions,Normal Game,What’s the strangest dream you’ve ever had?,Random / Wildcard,Text Answer,,,1,3,emotional,future,"emotional, deep, future, fun",,,,"date-night, normal",deep-connection,future-plans,text,text,,,,,,,,,,,
Questions,Normal Game,Would you rather live without music or without movies?,Random / Wildcard,Preference,live without music | without movies,,1,2,playful,lifestyle,"entertainment, fun, random, hypothetical, lifestyle",,,,"quick-fire, warm-up",funny-break,entertainment,multipleChoice,multipleChoice,,,,,,,,,,,Text Answer
Questions,Normal Game,What quality do you value most in a partner?,Relationships,Text Answer,,,1,3,romantic,romance,"romantic, memories, future, fun",,,,"date-night, normal",romantic-moment,memories,text,text,,,,,,,,,,,
Questions,Normal Game,What’s your love language?,Relationships,Text Answer,,,1,3,romantic,romance,"romantic, memories, future, fun",,,,"date-night, normal",romantic-moment,memories,text,text,,,,,,,,,,,
Questions,Normal Game,Do you believe in soulmates?,Relationships,Text Answer,,,1,2,playful,lifestyle,"fun, lifestyle, general",,,,"quick-fire, warm-up",funny-break,lifestyle,text,text,,,,,,,,,,,
Questions,Normal Game,How did your parents influence your views on relationships?,Relationships,Text Answer,,,1,2,playful,lifestyle,"fun, lifestyle, general",,,,"quick-fire, warm-up",funny-break,lifestyle,text,text,,,,,,,,,,,
Questions,Normal Game,What’s the best relationship advice you’ve ever received?,Relationships,Text Answer,,,1,3,romantic,romance,"romantic, memories, future, fun",,,,"date-night, normal",romantic-moment,memories,text,text,,,,,,,,,,,
Questions,Normal Game,Do you think opposites attract?,Relationships,Text Answer,,,1,2,playful,lifestyle,"fun, lifestyle, general",,,,"quick-fire, warm-up",funny-break,lifestyle,text,text,,,,,,,,,,,
Questions,Normal Game,What’s your ideal date night?,Relationships,Text Answer,,,1,3,romantic,romance,"romantic, memories, future, fun",,,,"date-night, normal",romantic-moment,memories,text,text,,,,,,,,,,,
Questions,Normal Game,How important is communication in a relationship to you?,Relationships,Text Answer,,,1,3,romantic,romance,"romantic, memories, future, fun",,,,"date-night, normal",romantic-moment,memories,text,text,,,,,,,,,,,
Questions,Normal Game,Do you think trust can be rebuilt once broken?,Relationships,Text Answer,,,1,4,playful,trust,"trust, fun, lifestyle, general",,,,"spicy-night, final-round",spicy-escalation,jealousy-trust,text,text,,,,,,,,,,,
Questions,Normal Game,What’s a deal-breaker for you in relationships?,Relationships,Text Answer,,,1,2,playful,lifestyle,"fun, lifestyle, general",,,,"quick-fire, warm-up",funny-break,lifestyle,text,text,,,,,,,,,,,
Questions,Normal Game,How do you like to show affection?,Relationships,Text Answer,,,1,2,playful,lifestyle,"fun, lifestyle, general",,,,"quick-fire, warm-up",funny-break,lifestyle,text,text,,,,,,,,,,,
Questions,Normal Game,What’s your favorite memory from our relationship?,Relationships,Text Answer,,,1,3,romantic,romance,"romantic, memories, future, fun",,,,"date-night, normal",romantic-moment,memories,text,text,,,,,,,,,,,
Questions,Normal Game,How do you handle disagreements in a relationship?,Relationships,Text Answer,,,1,3,romantic,romance,"romantic, memories, future, fun",,,,"date-night, normal",romantic-moment,memories,text,text,,,,,,,,,,,
Questions,Normal Game,What does commitment mean to you?,Relationships,Text Answer,,,1,2,playful,lifestyle,"fun, lifestyle, general",,,,"quick-fire, warm-up",funny-break,lifestyle,text,text,,,,,,,,,,,
Questions,Normal Game,What’s one thing you think keeps relationships strong?,Relationships,Text Answer,,,1,2,playful,lifestyle,"fun, lifestyle, general",,,,"quick-fire, warm-up",funny-break,lifestyle,text,text,,,,,,,,,,,
Questions,Normal Game,Do you prefer to spend a lot of time together or have lots of space?,Relationships,Text Answer,,,1,2,playful,lifestyle,"money, lifestyle, fun, general",,,,"quick-fire, warm-up",funny-break,finance,text,text,,,,,,,,,,,
Questions,Normal Game,What’s the best surprise you’ve ever planned for a partner?,Relationships,Text Answer,,,1,3,romantic,romance,"romantic, memories, future, fun",,,,"date-night, normal",romantic-moment,memories,text,text,,,,,,,,,,,
Questions,Normal Game,What makes you feel most loved?,Relationships,Text Answer,,,1,2,playful,lifestyle,"fun, lifestyle, general",,,,"quick-fire, warm-up",funny-break,lifestyle,text,text,,,,,,,,,,,
Questions,Normal Game,How do you prefer to celebrate anniversaries?,Relationships,Text Answer,,,1,2,playful,lifestyle,"fun, lifestyle, general",,,,"quick-fire, warm-up",funny-break,lifestyle,text,text,,,,,,,,,,,
Questions,Normal Game,What do you think is the most romantic gesture?,Relationships,Text Answer,,,1,3,romantic,romance,"romantic, memories, future, fun",,,,"date-night, normal",romantic-moment,memories,text,text,,,,,,,,,,,
Questions,Normal Game,What’s your idea of the perfect romantic getaway?,Romance,Text Answer,,,1,3,romantic,romance,"romantic, memories, future, fun",,,,"date-night, normal",romantic-moment,memories,text,text,,,,,,,,,,,
Questions,Normal Game,What song would you put on a romantic playlist?,Romance,Text Answer,,,1,3,romantic,romance,"entertainment, memories, fun, lifestyle, romantic, future",,,,"date-night, normal",romantic-moment,memories,text,text,,,,,,,,,,,
Questions,Normal Game,Do you enjoy love letters?,Romance,Text Answer,,,1,3,romantic,romance,"romantic, memories, future, fun",,,,"date-night, normal",romantic-moment,memories,text,text,,,,,,,,,,,
Questions,Normal Game,What’s the most romantic movie you’ve ever seen?,Romance,Text Answer,,,1,3,romantic,romance,"entertainment, memories, fun, lifestyle, romantic, future",,,,"date-night, normal",romantic-moment,memories,text,text,,,,,,,,,,,
Questions,Normal Game,What scent reminds you of romance?,Romance,Text Answer,,,1,2,playful,lifestyle,"fun, lifestyle, general",,,,"quick-fire, warm-up",funny-break,lifestyle,text,text,,,,,,,,,,,
Questions,Normal Game,Do you like PDA or prefer keeping romance private?,Romance,Text Answer,,,1,2,playful,lifestyle,"fun, lifestyle, general",,,,"quick-fire, warm-up",funny-break,lifestyle,text,text,,,,,,,,,,,
Questions,Normal Game,What’s a romantic gesture you’d love to experience?,Romance,Text Answer,,,1,3,romantic,romance,"romantic, memories, future, fun",,,,"date-night, normal",romantic-moment,memories,text,text,,,,,,,,,,,
Questions,Normal Game,Which city do you think is the most romantic?,Romance,Text Answer,,,1,3,romantic,romance,"memories, lifestyle, romantic, travel, future",,,,"date-night, normal",romantic-moment,memories,text,text,,,,,,,,,,,
Questions,Normal Game,Do you prefer fancy dinners or cozy nights in?,Romance,Text Answer,,,1,2,playful,lifestyle,"fun, lifestyle, general",,,,"quick-fire, warm-up",funny-break,lifestyle,text,text,,,,,,,,,,,
Questions,Normal Game,What’s the most romantic thing someone has done for you?,Romance,Text Answer,,,1,3,romantic,romance,"romantic, memories, future, fun",,,,"date-night, normal",romantic-moment,memories,text,text,,,,,,,,,,,
Questions,Normal Game,How do you set the mood for a romantic evening?,Romance,Text Answer,,,1,3,romantic,romance,"romantic, memories, future, fun",,,,"date-night, normal",romantic-moment,memories,text,text,,,,,,,,,,,
Questions,Normal Game,What flower do you associate with love?,Romance,Text Answer,,,1,3,romantic,romance,"romantic, memories, future, fun",,,,"date-night, normal",romantic-moment,memories,text,text,,,,,,,,,,,
Questions,Normal Game,Would you rather receive chocolates or jewelry as a romantic gift?,Romance,Preference,receive chocolates | jewelry as a romantic gift,,1,3,romantic,romance,"memories, fun, random, hypothetical, romantic, future",,,,"date-night, normal",romantic-moment,memories,multipleChoice,multipleChoice,,,,,,,,,,,Text Answer
Questions,Normal Game,Do you think romance fades over time?,Romance,Text Answer,,,1,2,playful,lifestyle,"fun, lifestyle, general",,,,"quick-fire, warm-up",funny-break,lifestyle,text,text,,,,,,,,,,,
Questions,Normal Game,What’s your favorite love story (real or fictional)?,Romance,Text Answer,,,1,3,romantic,romance,"romantic, memories, future, fun",,,,"date-night, normal",romantic-moment,memories,text,text,,,,,,,,,,,
Questions,Normal Game,How do you feel about Valentine’s Day?,Romance,Text Answer,,,1,2,playful,lifestyle,"fun, lifestyle, general",,,,"quick-fire, warm-up",funny-break,lifestyle,text,text,,,,,,,,,,,
Questions,Normal Game,What’s the most romantic line you’ve heard in a song?,Romance,Text Answer,,,1,3,romantic,romance,"entertainment, memories, fun, lifestyle, romantic, future",,,,"date-night, normal",romantic-moment,memories,text,text,,,,,,,,,,,
Questions,Normal Game,Do you enjoy slow dancing?,Romance,Text Answer,,,1,2,playful,lifestyle,"fun, lifestyle, general",,,,"quick-fire, warm-up",funny-break,lifestyle,text,text,,,,,,,,,,,
Questions,Normal Game,What’s your favorite romantic compliment?,Romance,Text Answer,,,1,3,romantic,romance,"romantic, memories, future, fun",,,,"date-night, normal",romantic-moment,memories,text,text,,,,,,,,,,,
Questions,Normal Game,What’s one romantic tradition you want to start?,Romance,Text Answer,,,1,3,romantic,romance,"romantic, memories, future, fun",,,,"date-night, normal",romantic-moment,memories,text,text,,,,,,,,,,,
Questions,Normal Game,What’s your biggest turn-on?,Sexual,Text Answer,,,1,4,spicy,sex,"sex-life, hot, attraction, spicy",,,,"spicy-night, final-round",spicy-escalation,bedroom-intimacy,text,text,,,,,,,,,,,
Questions,Normal Game,Do you prefer morning or evening intimacy?,Sexual,Text Answer,,,1,2,playful,lifestyle,"fun, lifestyle, general",,,,"quick-fire, warm-up",funny-break,lifestyle,text,text,,,,,,,,,,,
Questions,Normal Game,What’s a fantasy you’d like to explore together?,Sexual,Text Answer,,,1,4,spicy,sex,"sex-life, hot, attraction, spicy",,,,"spicy-night, final-round",spicy-escalation,bedroom-intimacy,text,text,,,,,,,,,,,
Questions,Normal Game,How do you feel about using toys in the bedroom?,Sexual,Text Answer,,,1,2,playful,lifestyle,"fun, lifestyle, general",,,,"quick-fire, warm-up",funny-break,lifestyle,text,text,,,,,,,,,,,
Questions,Normal Game,What’s your favorite way to be touched?,Sexual,Text Answer,,,1,2,playful,lifestyle,"fun, lifestyle, general",,,,"quick-fire, warm-up",funny-break,lifestyle,text,text,,,,,,,,,,,
Questions,Normal Game,Do you have a favorite part of my body?,Sexual,Text Answer,,,1,2,playful,lifestyle,"fun, lifestyle, general",,,,"quick-fire, warm-up",funny-break,lifestyle,text,text,,,,,,,,,,,
Questions,Normal Game,What’s something new you’ve always wanted to try?,Sexual,Text Answer,,,1,2,playful,lifestyle,"fun, lifestyle, general",,,,"quick-fire, warm-up",funny-break,lifestyle,text,text,,,,,,,,,,,
Questions,Normal Game,How important is foreplay to you?,Sexual,Text Answer,,,1,4,spicy,sex,"sex-life, hot, attraction, spicy",,,,"spicy-night, final-round",spicy-escalation,bedroom-intimacy,text,text,,,,,,,,,,,
Questions,Normal Game,What kind of lingerie or underwear do you find most attractive?,Sexual,Text Answer,,,1,2,playful,lifestyle,"fun, lifestyle, general",,,,"quick-fire, warm-up",funny-break,lifestyle,text,text,,,,,,,,,,,
Questions,Normal Game,What’s a non-sexual habit of mine you find sexy?,Sexual,Text Answer,,,1,4,spicy,sex,"hot, habits, sex-life, personality, attraction, spicy",,,,"spicy-night, final-round",spicy-escalation,bedroom-intimacy,text,text,,,,,,,,,,,
Questions,Normal Game,Do you like talking during intimacy or staying quiet?,Sexual,Text Answer,,,1,2,playful,lifestyle,"fun, lifestyle, general",,,,"quick-fire, warm-up",funny-break,lifestyle,text,text,,,,,,,,,,,
Questions,Normal Game,What’s the most adventurous place you’d want to be intimate?,Sexual,Text Answer,,,1,2,playful,future,"future, travel, lifestyle, fun",,,,"quick-fire, warm-up",funny-break,future-plans,text,text,,,,,,,,,,,
Questions,Normal Game,How do you feel about spontaneous intimacy vs planned?,Sexual,Text Answer,,,1,2,playful,lifestyle,"fun, lifestyle, general",,,,"quick-fire, warm-up",funny-break,lifestyle,text,text,,,,,,,,,,,
Questions,Normal Game,Do you prefer lights on or off?,Sexual,Text Answer,,,1,2,playful,lifestyle,"fun, lifestyle, general",,,,"quick-fire, warm-up",funny-break,lifestyle,text,text,,,,,,,,,,,
Questions,Normal Game,"What music, if any, do you enjoy during intimacy?",Sexual,Text Answer,,,1,2,playful,lifestyle,"entertainment, fun, lifestyle, general",,,,"quick-fire, warm-up",funny-break,entertainment,text,text,,,,,,,,,,,
Questions,Normal Game,What’s your favorite after-intimacy activity?,Sexual,Text Answer,,,1,2,playful,lifestyle,"fun, lifestyle, general",,,,"quick-fire, warm-up",funny-break,lifestyle,text,text,,,,,,,,,,,
Questions,Normal Game,How do you communicate what you want in bed?,Sexual,Text Answer,,,1,2,playful,lifestyle,"fun, lifestyle, general",,,,"quick-fire, warm-up",funny-break,lifestyle,text,text,,,,,,,,,,,
Questions,Normal Game,What’s an instant mood killer for you?,Sexual,Text Answer,,,1,2,playful,lifestyle,"fun, lifestyle, general",,,,"quick-fire, warm-up",funny-break,lifestyle,text,text,,,,,,,,,,,
Questions,Normal Game,Are you more dominant or submissive?,Sexual,Text Answer,,,1,2,playful,lifestyle,"fun, lifestyle, general",,,,"quick-fire, warm-up",funny-break,lifestyle,text,text,,,,,,,,,,,
Questions,Normal Game,How do you feel about role-playing?,Sexual,Text Answer,,,1,2,playful,lifestyle,"fun, lifestyle, general",,,,"quick-fire, warm-up",funny-break,lifestyle,text,text,,,,,,,,,,,
Questions,Normal Game,What’s your favorite sport to watch?,Sports,Text Answer,,,1,2,playful,lifestyle,"entertainment, sports, fun, lifestyle",,,,"quick-fire, warm-up",funny-break,entertainment,text,text,,,,,,,,,,,
Questions,Normal Game,Have you ever played on a sports team?,Sports,Text Answer,,,1,2,playful,lifestyle,"entertainment, sports, fun, lifestyle",,,,"quick-fire, warm-up",funny-break,entertainment,text,text,,,,,,,,,,,
Questions,Normal Game,What’s the most memorable sporting event you’ve attended?,Sports,Text Answer,,,1,2,playful,lifestyle,"fun, lifestyle, general",,,,"quick-fire, warm-up",funny-break,lifestyle,text,text,,,,,,,,,,,
Questions,Normal Game,Who is your favorite athlete of all time?,Sports,Text Answer,,,1,2,playful,lifestyle,"fun, lifestyle, general",,,,"quick-fire, warm-up",funny-break,lifestyle,text,text,,,,,,,,,,,
Questions,Normal Game,Do you prefer watching sports live or on TV?,Sports,Text Answer,,,1,2,playful,lifestyle,"entertainment, sports, fun, lifestyle",,,,"quick-fire, warm-up",funny-break,entertainment,text,text,,,,,,,,,,,
Questions,Normal Game,What’s your earliest sports memory?,Sports,Text Answer,,,1,2,playful,lifestyle,"entertainment, sports, fun, lifestyle",,,,"quick-fire, warm-up",funny-break,entertainment,text,text,,,,,,,,,,,
Questions,Normal Game,"If you could go to any sporting event in the world, what would it be?",Sports,Text Answer,,,1,2,playful,future,"fun, random, hypothetical, lifestyle, future, travel",,,,"quick-fire, warm-up",funny-break,future-plans,text,text,,,,,,,,,,,
Questions,Normal Game,What’s a sport you enjoy but others might not expect?,Sports,Text Answer,,,1,2,playful,lifestyle,"entertainment, sports, fun, lifestyle",,,,"quick-fire, warm-up",funny-break,entertainment,text,text,,,,,,,,,,,
Questions,Normal Game,"Do you support a specific team? If so, which?",Sports,Text Answer,,,1,2,playful,lifestyle,"sports, fun, lifestyle, general",,,,"quick-fire, warm-up",funny-break,entertainment,text,text,,,,,,,,,,,
Questions,Normal Game,Have you ever met a professional athlete?,Sports,Text Answer,,,1,2,playful,lifestyle,"fun, lifestyle, general",,,,"quick-fire, warm-up",funny-break,lifestyle,text,text,,,,,,,,,,,
Questions,Normal Game,What sport would you like to learn?,Sports,Text Answer,,,1,2,playful,lifestyle,"entertainment, sports, fun, lifestyle",,,,"quick-fire, warm-up",funny-break,entertainment,text,text,,,,,,,,,,,
Questions,Normal Game,Do you prefer team sports or individual sports?,Sports,Text Answer,,,1,2,playful,lifestyle,"entertainment, sports, fun, lifestyle",,,,"quick-fire, warm-up",funny-break,entertainment,text,text,,,,,,,,,,,
Questions,Normal Game,What’s the most challenging sport in your opinion?,Sports,Text Answer,,,1,2,playful,lifestyle,"entertainment, sports, fun, lifestyle",,,,"quick-fire, warm-up",funny-break,entertainment,text,text,,,,,,,,,,,
Questions,Normal Game,Who was your sports idol growing up?,Sports,Text Answer,,,1,2,playful,lifestyle,"entertainment, sports, fun, lifestyle",,,,"quick-fire, warm-up",funny-break,entertainment,text,text,,,,,,,,,,,
Questions,Normal Game,What’s a sports tradition you love?,Sports,Text Answer,,,1,3,romantic,romance,"entertainment, sports, memories, fun, lifestyle, romantic, future",,,,"date-night, normal",romantic-moment,memories,text,text,,,,,,,,,,,
Questions,Normal Game,Have you ever been injured while playing a sport?,Sports,Text Answer,,,1,2,playful,lifestyle,"entertainment, sports, fun, lifestyle",,,,"quick-fire, warm-up",funny-break,entertainment,text,text,,,,,,,,,,,
Questions,Normal Game,Which Olympic event do you look forward to the most?,Sports,Text Answer,,,1,2,playful,lifestyle,"fun, lifestyle, general",,,,"quick-fire, warm-up",funny-break,lifestyle,text,text,,,,,,,,,,,
Questions,Normal Game,Do you enjoy extreme sports?,Sports,Text Answer,,,1,2,playful,lifestyle,"entertainment, sports, fun, lifestyle",,,,"quick-fire, warm-up",funny-break,entertainment,text,text,,,,,,,,,,,
Questions,Normal Game,What’s your favorite sports movie?,Sports,Text Answer,,,1,2,playful,lifestyle,"entertainment, sports, fun, lifestyle",,,,"quick-fire, warm-up",funny-break,entertainment,text,text,,,,,,,,,,,
Questions,Normal Game,Would you rather play or coach a team?,Sports,Preference,play | coach a team,,1,2,playful,lifestyle,"entertainment, sports, fun, random, hypothetical, lifestyle",,,,"quick-fire, warm-up",funny-break,entertainment,multipleChoice,multipleChoice,,,,,,,,,,,Text Answer
Questions,Normal Game,What piece of technology can you not live without?,Technology,Text Answer,,,1,2,playful,lifestyle,"fun, lifestyle, general",,,,"quick-fire, warm-up",funny-break,lifestyle,text,text,,,,,,,,,,,
Questions,Normal Game,Do you prefer Android or iOS?,Technology,Text Answer,,,1,2,playful,lifestyle,"fun, lifestyle, general",,,,"quick-fire, warm-up",funny-break,lifestyle,text,text,,,,,,,,,,,
Questions,Normal Game,What app do you use the most on your phone?,Technology,Text Answer,,,1,2,playful,lifestyle,"fun, lifestyle, general",,,,"quick-fire, warm-up",funny-break,lifestyle,text,text,,,,,,,,,,,
Questions,Normal Game,Would you rather give up social media or streaming services?,Technology,Preference,give up social media | streaming services,,1,2,playful,lifestyle,"fun, random, hypothetical, lifestyle",,,,"quick-fire, warm-up",funny-break,lifestyle,multipleChoice,multipleChoice,,,,,,,,,,,Text Answer
Questions,Normal Game,What’s your favorite video game?,Technology,Text Answer,,,1,2,competitive,lifestyle,"entertainment, sports, fun, lifestyle",,,,"quick-fire, warm-up",escalation,entertainment,text,text,,,,,,,,,,,
Questions,Normal Game,How often do you upgrade your phone?,Technology,Text Answer,,,1,2,playful,lifestyle,"fun, lifestyle, general",,,,"quick-fire, warm-up",funny-break,lifestyle,text,text,,,,,,,,,,,
Questions,Normal Game,Do you enjoy smart home devices?,Technology,Text Answer,,,1,2,playful,lifestyle,"fun, lifestyle, general",,,,"quick-fire, warm-up",funny-break,lifestyle,text,text,,,,,,,,,,,
Questions,Normal Game,What technology are you most excited about in the future?,Technology,Text Answer,,,1,2,playful,future,"future, fun, lifestyle, general",,,,"quick-fire, warm-up",funny-break,future-plans,text,text,,,,,,,,,,,
Questions,Normal Game,Do you prefer texting or phone calls?,Technology,Text Answer,,,1,2,playful,lifestyle,"fun, lifestyle, general",,,,"quick-fire, warm-up",funny-break,lifestyle,text,text,,,,,,,,,,,
Questions,Normal Game,What’s your favorite tech gadget from childhood?,Technology,Text Answer,,,1,3,playful,memories,"childhood, memories, fun, lifestyle",,,,"date-night, normal",deep-connection,memories,text,text,,,,,,,,,,,
Questions,Normal Game,Have you ever built a PC?,Technology,Text Answer,,,1,2,playful,lifestyle,"fun, lifestyle, general",,,,"quick-fire, warm-up",funny-break,lifestyle,text,text,,,,,,,,,,,
Questions,Normal Game,How do you feel about virtual reality?,Technology,Text Answer,,,1,2,playful,lifestyle,"fun, lifestyle, general",,,,"quick-fire, warm-up",funny-break,lifestyle,text,text,,,,,,,,,,,
Questions,Normal Game,What’s one tech skill you wish you had?,Technology,Text Answer,,,1,2,playful,lifestyle,"fun, lifestyle, general",,,,"quick-fire, warm-up",funny-break,lifestyle,text,text,,,,,,,,,,,
Questions,Normal Game,Do you worry about AI taking over jobs?,Technology,Text Answer,,,1,2,playful,lifestyle,"fun, lifestyle, general",,,,"quick-fire, warm-up",funny-break,lifestyle,text,text,,,,,,,,,,,
