Sheet,Game,Question,Category,Question Type,Options,Correct Answer,Active,Intensity,Tone,Relationship Area,Tags,Notes,Memory Lane Mode,Avoid If,Game Suitability,AI Use Case,Repeat Group,Default Answer Type,Answer Type,Unit Label,Scoring Divisor,Rounding Mode,Round Penalty Value,Fixed Penalty,Scoring Mode,Scoring Outcome Type,Source Label,Added By,Original Sheet,Original Question Type
Questions,Normal Game,What is your favourite sex position?,Sexual,Favourite,,,1,4,spicy,sex,"sex-life, hot, attraction, spicy",,,,"spicy-night, final-round",spicy-escalation,bedroom-intimacy,text,text,,,,,,,,,,,
Questions,Normal Game,What do you think my biggest turn-on is?,Sexual,Text Answer,,,1,4,spicy,sex,"sex-life, hot, attraction, spicy",,,,"spicy-night, final-round",spicy-escalation,bedroom-intimacy,text,text,,,,,,,,,,,
Questions,Normal Game,Who is more likely to cry during a film?,Films & TV,Multiple Choice,Jay | Kim | Both | Neither,,1,2,competitive,lifestyle,"entertainment, fun, lifestyle, general",,,,"quick-fire, warm-up",escalation,entertainment,multipleChoice,multipleChoice,,,,,,,,,,,
Questions,Normal Game,What age did you have your first kiss?,Childhood,Numeric,,,1,2,playful,lifestyle,"fun, lifestyle, general",,,,"quick-fire, warm-up",funny-break,lifestyle,number,number,,,,,,,,,,,
Questions,Normal Game,What do you think my dream holiday looks like?,Travel,Text Answer,,,1,3,emotional,future,"emotional, deep, lifestyle, future, travel, confidence",,,,"date-night, normal",deep-connection,confidence-risk,text,text,,,,,,,,,,,
Questions,Normal Game,Would you rather give up social media or alcohol?,Lifestyle,Preference,give up social media | alcohol,,1,2,playful,lifestyle,"fun, random, hypothetical, lifestyle",,,,"quick-fire, warm-up",funny-break,lifestyle,multipleChoice,multipleChoice,,,,,,,,,,,
Questions,Normal Game,What outfit do you think suits me best?,Fashion & Style,Text Answer,,,1,2,playful,lifestyle,"fun, lifestyle, general",,,,"quick-fire, warm-up",funny-break,lifestyle,text,text,,,,,,,,,,,
Questions,Normal Game,What is your most embarrassing drunk moment?,Embarrassing Moments,Text Answer,,,1,3,awkward,lifestyle,"awkward, embarrassing, fun, lifestyle",,,embarrassment-risk,"date-night, normal",deep-connection,lifestyle,text,text,,,,,,,,,,,
Questions,Normal Game,What is one thing you think I overthink?,Personality,Text Answer,,,1,2,playful,lifestyle,"fun, lifestyle, general",,,,"quick-fire, warm-up",funny-break,lifestyle,text,text,,,,,,,,,,,
Questions,Normal Game,What do you think my ideal date night is?,Romance,Text Answer,,,1,3,romantic,romance,"romantic, memories, future, fun",,,,"date-night, normal",romantic-moment,memories,text,text,,,,,,,,,,,
Questions,Normal Game,What song always makes you think of me?,Music,Text Answer,,,1,2,playful,lifestyle,"entertainment, fun, lifestyle, general",,,,"quick-fire, warm-up",funny-break,entertainment,text,text,,,,,,,,,,,
Questions,Normal Game,What is your go-to comfort food?,Food & Drink,Favourite,,,1,2,playful,lifestyle,"food, drink, lifestyle, fun",,,,"quick-fire, warm-up",funny-break,food-drink,text,text,,,,,,,,,,,
Questions,Normal Game,What do you think my favourite movie is?,Films & TV,Text Answer,,,1,2,playful,lifestyle,"entertainment, fun, lifestyle, general",,,,"quick-fire, warm-up",funny-break,entertainment,text,text,,,,,,,,,,,
Questions,Normal Game,Who is more likely to fall asleep first on a road trip?,Travel,Multiple Choice,Jay | Kim | Both | Neither,,1,2,competitive,future,"future, cars, travel, lifestyle",,,,"quick-fire, warm-up",escalation,future-plans,multipleChoice,multipleChoice,,,,,,,,,,,
Questions,Normal Game,What is your biggest pet peeve about me?,Pet Peeves,Pet Peeve,,,1,3,playful,habits,"personality, habits, fun, lifestyle",,,,"date-night, normal",deep-connection,habits,text,text,,,,,,,,,,,
Questions,Normal Game,What is the sexiest thing I do without trying?,Sexual,Text Answer,,,1,4,spicy,sex,"sex-life, hot, attraction, spicy",,,,"spicy-night, final-round",spicy-escalation,bedroom-intimacy,text,text,,,,,,,,,,,
Questions,Normal Game,Rank your top 3 dream holiday destinations.,Travel,Ranked / Top 3,,,1,3,emotional,future,"emotional, deep, lifestyle, future, travel",,,,"date-night, normal",deep-connection,future-plans,ranked,ranked,,,,,,,,,,,
Questions,Normal Game,What celebrity would you want to have dinner with?,Celebrities,Text Answer,,,1,2,playful,lifestyle,"fun, lifestyle, general",,,,"quick-fire, warm-up",funny-break,lifestyle,text,text,,,,,,,,,,,
Questions,Normal Game,Who is more likely to start a karaoke session?,Music,Multiple Choice,Jay | Kim | Both | Neither,,1,2,competitive,lifestyle,"fun, lifestyle, general",,,,"quick-fire, warm-up",escalation,lifestyle,multipleChoice,multipleChoice,,,,,,,,,,,
Questions,Normal Game,What is your favorite memory of us?,Memories,Text Answer,,,1,2,playful,lifestyle,"fun, lifestyle, general",,,,"quick-fire, warm-up",funny-break,lifestyle,text,text,,,,,,,,,,,
Questions,Normal Game,What do you think my favorite part of your body is?,Sexual,Text Answer,,,1,2,playful,lifestyle,"fun, lifestyle, general",,,,"quick-fire, warm-up",funny-break,lifestyle,text,text,,,,,,,,,,,
Questions,Normal Game,Would you rather stay in or go out for date night?,Lifestyle,Preference,stay in | go out for date night,,1,3,romantic,romance,"memories, fun, random, hypothetical, romantic, future",,,,"date-night, normal",romantic-moment,memories,multipleChoice,multipleChoice,,,,,,,,,,,
Questions,Normal Game,Who is more likely to forget an anniversary?,Relationships,Multiple Choice,Jay | Kim | Both | Neither,,1,2,competitive,lifestyle,"fun, lifestyle, general",,,,"quick-fire, warm-up",escalation,lifestyle,multipleChoice,multipleChoice,,,,,,,,,,,
Questions,Normal Game,What is your favourite drink to order at a bar?,Nightlife,Favourite,,,1,2,playful,lifestyle,"food, drink, lifestyle, fun",,,,"quick-fire, warm-up",funny-break,food-drink,text,text,,,,,,,,,,,
Questions,Normal Game,What do you think my perfect weekend looks like?,Lifestyle,Text Answer,,,1,3,emotional,lifestyle,"confidence, emotional, fun, lifestyle",,,,"date-night, normal",deep-connection,confidence-risk,text,text,,,,,,,,,,,
Questions,Normal Game,What embarrassing moment do you think I still laugh about?,Embarrassing Moments,Text Answer,,,1,2,playful,lifestyle,"fun, lifestyle, general",,,,"quick-fire, warm-up",funny-break,lifestyle,text,text,,,,,,,,,,,
Questions,Normal Game,Who is more likely to try a new food first?,Food & Drink,Multiple Choice,Jay | Kim | Both | Neither,,1,2,competitive,lifestyle,"food, drink, lifestyle, fun",,,,"quick-fire, warm-up",escalation,food-drink,multipleChoice,multipleChoice,,,,,,,,,,,
Questions,Normal Game,What is your favorite way to relax after a long day?,Health & Wellness,Favourite,,,1,2,playful,lifestyle,"fun, lifestyle, general",,,,"quick-fire, warm-up",funny-break,lifestyle,text,text,,,,,,,,,,,
Questions,Normal Game,What do you think I spend too much money on?,Money,Text Answer,,,1,2,playful,lifestyle,"money, lifestyle, fun, general",,,,"quick-fire, warm-up",funny-break,finance,text,text,,,,,,,,,,,
Questions,Normal Game,Who is more likely to go skydiving?,Random / Wildcard,Multiple Choice,Jay | Kim | Both | Neither,,1,2,competitive,lifestyle,"fun, lifestyle, general",,,,"quick-fire, warm-up",escalation,lifestyle,multipleChoice,multipleChoice,,,,,,,,,,,
Questions,Normal Game,What is your favourite guilty pleasure TV show?,Films & TV,Favourite,,,1,2,playful,lifestyle,"entertainment, fun, lifestyle, general",,,,"quick-fire, warm-up",funny-break,entertainment,text,text,,,,,,,,,,,
Questions,Normal Game,Would you rather travel to the past or the future?,Hypotheticals,Preference,travel to the past | the future,,1,2,playful,future,"fun, random, hypothetical, lifestyle, future, travel",,,,"quick-fire, warm-up",funny-break,future-plans,multipleChoice,multipleChoice,,,,,,,,,,,
Questions,Normal Game,What do you think my signature scent would be?,Fashion & Style,Text Answer,,,1,2,playful,lifestyle,"fun, lifestyle, general",,,,"quick-fire, warm-up",funny-break,lifestyle,text,text,,,,,,,,,,,
Questions,Normal Game,What is your favourite childhood snack?,Childhood,Favourite,,,1,3,playful,memories,"memories, food, lifestyle, childhood, drink",,,,"date-night, normal",deep-connection,memories,text,text,,,,,,,,,,,
Questions,Normal Game,Who is more likely to get lost even with GPS?,Technology,Multiple Choice,Jay | Kim | Both | Neither,,1,2,competitive,lifestyle,"fun, lifestyle, general",,,,"quick-fire, warm-up",escalation,lifestyle,multipleChoice,multipleChoice,,,,,,,,,,,
Questions,Normal Game,What do you think my hidden talent is?,General Knowledge About Me,Text Answer,,,1,2,playful,lifestyle,"fun, lifestyle, general",,,,"quick-fire, warm-up",funny-break,lifestyle,text,text,,,,,,,,,,,
Questions,Normal Game,Would you rather be able to read minds or fly?,Hypotheticals,Preference,able to read minds | fly,,1,2,playful,lifestyle,"fun, random, hypothetical, lifestyle",,,,"quick-fire, warm-up",funny-break,lifestyle,multipleChoice,multipleChoice,,,,,,,,,,,
Questions,Normal Game,What is your favourite sport to watch?,Sports,Favourite,,,1,2,playful,lifestyle,"entertainment, sports, fun, lifestyle",,,,"quick-fire, warm-up",funny-break,entertainment,text,text,,,,,,,,,,,
Questions,Normal Game,Who is more likely to start a dance-off at a party?,Nightlife,Multiple Choice,Jay | Kim | Both | Neither,,1,2,competitive,lifestyle,"fun, lifestyle, general",,,,"quick-fire, warm-up",escalation,lifestyle,multipleChoice,multipleChoice,,,,,,,,,,,
Questions,Normal Game,What hobby would you love for us to try together?,Lifestyle,Text Answer,,,1,3,romantic,romance,"entertainment, memories, fun, lifestyle, romantic, future",,,,"date-night, normal",romantic-moment,memories,text,text,,,,,,,,,,,
Questions,Normal Game,What do you think my dream car is?,Cars & Driving,Text Answer,,,1,3,emotional,future,"emotional, deep, lifestyle, cars, future",,,,"date-night, normal",deep-connection,future-plans,text,text,,,,,,,,,,,
Questions,Normal Game,Would you rather have a personal chef or personal trainer?,Health & Wellness,Preference,a personal chef | personal trainer,,1,2,playful,lifestyle,"fun, random, hypothetical, lifestyle",,,,"quick-fire, warm-up",funny-break,lifestyle,multipleChoice,multipleChoice,,,,,,,,,,,
Questions,Normal Game,What is your favourite holiday tradition?,Holidays,Favourite,,,1,2,playful,future,"future, travel, lifestyle, fun",,,,"quick-fire, warm-up",funny-break,future-plans,text,text,,,,,,,,,,,
Questions,Normal Game,Who is more likely to prank the other?,Random / Wildcard,Multiple Choice,Jay | Kim | Both | Neither,,1,2,competitive,lifestyle,"fun, lifestyle, general",,,,"quick-fire, warm-up",escalation,lifestyle,multipleChoice,multipleChoice,,,,,,,,,,,
Questions,Normal Game,What do you think my ultimate career goal is?,Future / Goals,Text Answer,,,1,3,emotional,future,"emotional, deep, future, fun",,,,"date-night, normal",deep-connection,future-plans,text,text,,,,,,,,,,,
Questions,Normal Game,What is your favourite thing about me?,Romance,Favourite,,,1,2,playful,lifestyle,"fun, lifestyle, general",,,,"quick-fire, warm-up",funny-break,lifestyle,text,text,,,,,,,,,,,
Questions,Normal Game,Who is more likely to plan a surprise trip?,Travel,Multiple Choice,Jay | Kim | Both | Neither,,1,2,competitive,future,"future, travel, lifestyle, fun",,,,"quick-fire, warm-up",escalation,future-plans,multipleChoice,multipleChoice,,,,,,,,,,,
Questions,Normal Game,What is your favourite way to spend a rainy day?,Home,Favourite,,,1,2,playful,lifestyle,"money, lifestyle, fun, general",,,,"quick-fire, warm-up",funny-break,finance,text,text,,,,,,,,,,,
Questions,Normal Game,Would you rather know the date of your death or the cause?,Hypotheticals,Preference,know the date of your death | the cause,,1,2,playful,lifestyle,"fun, random, hypothetical, lifestyle",,,,"quick-fire, warm-up",funny-break,lifestyle,multipleChoice,multipleChoice,,,,,,,,,,,
Questions,Normal Game,Who is more likely to adopt a pet on impulse?,Lifestyle,Multiple Choice,Jay | Kim | Both | Neither,,1,2,competitive,lifestyle,"fun, lifestyle, general",,,,"quick-fire, warm-up",escalation,lifestyle,multipleChoice,multipleChoice,,,,,,,,,,,
Questions,Normal Game,What is one moment in our relationship you’ll never forget?,Memories,Text Answer,,,1,3,romantic,romance,"romantic, memories, future, fun",,,,"date-night, normal",romantic-moment,memories,text,text,,,,,,,,,,,
Questions,Normal Game,What’s one compliment from me that stuck with you?,Relationships,Text Answer,,,1,2,playful,lifestyle,"fun, lifestyle, general",,,,"quick-fire, warm-up",funny-break,lifestyle,text,text,,,,,,,,,,,
Questions,Normal Game,What is your favourite way to flirt with me?,Romance,Favourite,,,1,2,playful,lifestyle,"fun, lifestyle, general",,,,"quick-fire, warm-up",funny-break,lifestyle,text,text,,,,,,,,,,,
Questions,Normal Game,Would you rather have unlimited money or unlimited time?,Hypotheticals,Preference,unlimited money | unlimited time,,1,2,playful,lifestyle,"fun, random, hypothetical, lifestyle, money",,,,"quick-fire, warm-up",funny-break,finance,multipleChoice,multipleChoice,,,,,,,,,,,
Questions,Normal Game,What is your dream car and why?,Cars & Driving,Text Answer,,,1,3,emotional,future,"emotional, deep, lifestyle, cars, future",,,,"date-night, normal",deep-connection,future-plans,text,text,,,,,,,,,,,
Questions,Normal Game,"Who taught you to drive, and how was your first driving experience?",Cars & Driving,Text Answer,,,1,2,playful,lifestyle,"cars, lifestyle, fun, general",,,,"quick-fire, warm-up",funny-break,lifestyle,text,text,,,,,,,,,,,
Questions,Normal Game,What is your biggest driving pet peeve?,Cars & Driving,Text Answer,,,1,3,playful,habits,"cars, lifestyle, personality, habits",,,,"date-night, normal",deep-connection,habits,text,text,,,,,,,,,,,
Questions,Normal Game,What song do you love to blast while driving?,Cars & Driving,Text Answer,,,1,3,romantic,romance,"entertainment, memories, fun, lifestyle, romantic, cars, future",,,,"date-night, normal",romantic-moment,memories,text,text,,,,,,,,,,,
Questions,Normal Game,"If we went on a road trip tomorrow, where would you want to go?",Cars & Driving,Text Answer,,,1,2,playful,future,"future, cars, travel, lifestyle",,,,"quick-fire, warm-up",funny-break,future-plans,text,text,,,,,,,,,,,
Questions,Normal Game,What’s the longest road trip you’ve ever been on?,Cars & Driving,Text Answer,,,1,2,playful,future,"future, cars, travel, lifestyle",,,,"quick-fire, warm-up",funny-break,future-plans,text,text,,,,,,,,,,,
Questions,Normal Game,"If you could drive any vehicle in a movie, which would you pick?",Cars & Driving,Text Answer,,,1,2,playful,lifestyle,"entertainment, fun, random, hypothetical, lifestyle, cars",,,,"quick-fire, warm-up",funny-break,entertainment,text,text,,,,,,,,,,,
Questions,Normal Game,What’s your favorite snack to have on a long drive?,Cars & Driving,Text Answer,,,1,2,playful,lifestyle,"cars, food, drink, lifestyle",,,,"quick-fire, warm-up",funny-break,food-drink,text,text,,,,,,,,,,,
Questions,Normal Game,Are you more of a careful driver or a speed demon?,Cars & Driving,Text Answer,,,1,2,playful,lifestyle,"cars, lifestyle, fun, general",,,,"quick-fire, warm-up",funny-break,lifestyle,text,text,,,,,,,,,,,
Questions,Normal Game,Have you ever named a car you owned?,Cars & Driving,Text Answer,,,1,2,playful,lifestyle,"cars, lifestyle, fun, general",,,,"quick-fire, warm-up",funny-break,lifestyle,text,text,,,,,,,,,,,
Questions,Normal Game,What's one thing you must have in your car at all times?,Cars & Driving,Text Answer,,,1,2,playful,lifestyle,"cars, lifestyle, fun, general",,,,"quick-fire, warm-up",funny-break,lifestyle,text,text,,,,,,,,,,,
Questions,Normal Game,What’s the worst traffic jam you’ve ever experienced?,Cars & Driving,Text Answer,,,1,4,savage,lifestyle,"savage, cars, lifestyle, fun",,,argument-risk,"spicy-night, final-round",spicy-escalation,lifestyle,text,text,,,,,,,,,,,
Questions,Normal Game,Would you rather drive in city traffic or on country roads?,Cars & Driving,Preference,drive in city traffic | on country roads,,1,2,playful,future,"fun, random, hypothetical, lifestyle, cars, future, travel",,,,"quick-fire, warm-up",funny-break,future-plans,multipleChoice,multipleChoice,,,,,,,,,,,Text Answer
Questions,Normal Game,What’s the most scenic route you’ve ever taken?,Cars & Driving,Text Answer,,,1,2,playful,lifestyle,"fun, lifestyle, general",,,,"quick-fire, warm-up",funny-break,lifestyle,text,text,,,,,,,,,,,
Questions,Normal Game,"If you could eliminate one bad driving habit from the roads, what would it be?",Cars & Driving,Text Answer,,,1,3,playful,habits,"fun, random, hypothetical, habits, lifestyle, cars, personality",,,,"date-night, normal",deep-connection,habits,text,text,,,,,,,,,,,
Questions,Normal Game,What’s your favorite memory involving a car?,Cars & Driving,Text Answer,,,1,2,playful,lifestyle,"cars, lifestyle, fun, general",,,,"quick-fire, warm-up",funny-break,lifestyle,text,text,,,,,,,,,,,
Questions,Normal Game,Do you sing along to the radio when you’re alone in the car?,Cars & Driving,Text Answer,,,1,2,playful,lifestyle,"cars, lifestyle, fun, general",,,,"quick-fire, warm-up",funny-break,lifestyle,text,text,,,,,,,,,,,
Questions,Normal Game,What’s your favorite time of day to drive?,Cars & Driving,Text Answer,,,1,2,playful,lifestyle,"cars, lifestyle, fun, general",,,,"quick-fire, warm-up",funny-break,lifestyle,text,text,,,,,,,,,,,
Questions,Normal Game,Have you ever gotten lost on a drive and discovered something amazing?,Cars & Driving,Text Answer,,,1,2,playful,lifestyle,"cars, lifestyle, fun, general",,,,"quick-fire, warm-up",funny-break,lifestyle,text,text,,,,,,,,,,,
Questions,Normal Game,"If you had to choose between a vintage classic car or a modern electric car, which would you prefer?",Cars & Driving,Text Answer,,,1,2,playful,lifestyle,"cars, lifestyle, fun, general",,,,"quick-fire, warm-up",funny-break,lifestyle,text,text,,,,,,,,,,,
Questions,Normal Game,Which celebrity would you love to have as a best friend?,Celebrities,Text Answer,,,1,3,romantic,romance,"romantic, memories, future, fun",,,,"date-night, normal",romantic-moment,memories,text,text,,,,,,,,,,,
Questions,Normal Game,"If you could have dinner with any famous person, dead or alive, who would it be?",Celebrities,Text Answer,,,1,2,playful,lifestyle,"fun, random, hypothetical, lifestyle",,,,"quick-fire, warm-up",funny-break,lifestyle,text,text,,,,,,,,,,,
Questions,Normal Game,Whose celebrity style do you admire the most?,Celebrities,Text Answer,,,1,2,playful,lifestyle,"fun, lifestyle, general",,,,"quick-fire, warm-up",funny-break,lifestyle,text,text,,,,,,,,,,,
Questions,Normal Game,Which famous couple do you think seems genuinely happy?,Celebrities,Text Answer,,,1,2,playful,lifestyle,"fun, lifestyle, general",,,,"quick-fire, warm-up",funny-break,lifestyle,text,text,,,,,,,,,,,
Questions,Normal Game,What actor would play you in a movie about your life?,Celebrities,Text Answer,,,1,2,playful,lifestyle,"entertainment, fun, lifestyle, general",,,,"quick-fire, warm-up",funny-break,entertainment,text,text,,,,,,,,,,,
Questions,Normal Game,Which celebrity do you think is overrated?,Celebrities,Text Answer,,,1,2,playful,lifestyle,"fun, lifestyle, general",,,,"quick-fire, warm-up",funny-break,lifestyle,text,text,,,,,,,,,,,
Questions,Normal Game,Who is your all-time favorite musician or band?,Celebrities,Text Answer,,,1,2,playful,lifestyle,"entertainment, fun, lifestyle, general",,,,"quick-fire, warm-up",funny-break,entertainment,text,text,,,,,,,,,,,
Questions,Normal Game,"If you could switch lives with a celebrity for a day, who would it be?",Celebrities,Text Answer,,,1,2,playful,lifestyle,"fun, random, hypothetical, lifestyle",,,,"quick-fire, warm-up",funny-break,lifestyle,text,text,,,,,,,,,,,
Questions,Normal Game,Which celebrity’s fashion line would you actually wear?,Celebrities,Text Answer,,,1,2,playful,lifestyle,"fun, lifestyle, general",,,,"quick-fire, warm-up",funny-break,lifestyle,text,text,,,,,,,,,,,
Questions,Normal Game,What’s the most surprising fact you know about a celebrity?,Celebrities,Text Answer,,,1,2,playful,lifestyle,"fun, lifestyle, general",,,,"quick-fire, warm-up",funny-break,lifestyle,text,text,,,,,,,,,,,
Questions,Normal Game,Which famous person do you secretly follow on social media?,Celebrities,Text Answer,,,1,2,playful,lifestyle,"fun, lifestyle, general",,,,"quick-fire, warm-up",funny-break,lifestyle,text,text,,,,,,,,,,,
Questions,Normal Game,"If you could ask your favorite actor one question, what would it be?",Celebrities,Text Answer,,,1,2,playful,lifestyle,"fun, random, hypothetical, lifestyle",,,,"quick-fire, warm-up",funny-break,lifestyle,text,text,,,,,,,,,,,
Questions,Normal Game,Which celebrity do you think would make a great leader?,Celebrities,Text Answer,,,1,2,playful,lifestyle,"fun, lifestyle, general",,,,"quick-fire, warm-up",funny-break,lifestyle,text,text,,,,,,,,,,,
Questions,Normal Game,Who is your guilty pleasure celebrity crush?,Celebrities,Text Answer,,,1,3,romantic,romance,"romantic, memories, future, fun",,,,"date-night, normal",romantic-moment,memories,text,text,,,,,,,,,,,
Questions,Normal Game,What’s your favorite celebrity scandal or gossip story?,Celebrities,Text Answer,,,1,2,playful,lifestyle,"fun, lifestyle, general",,,,"quick-fire, warm-up",funny-break,lifestyle,text,text,,,,,,,,,,,
Questions,Normal Game,Which celebrity would you like to collaborate with on a creative project?,Celebrities,Text Answer,,,1,2,playful,lifestyle,"fun, lifestyle, general",,,,"quick-fire, warm-up",funny-break,lifestyle,text,text,,,,,,,,,,,
Questions,Normal Game,Who is the most down-to-earth famous person you’ve ever heard about?,Celebrities,Text Answer,,,1,2,playful,lifestyle,"fun, lifestyle, general",,,,"quick-fire, warm-up",funny-break,lifestyle,text,text,,,,,,,,,,,
Questions,Normal Game,Which celebrity do you think has aged the best?,Celebrities,Text Answer,,,1,2,playful,lifestyle,"fun, lifestyle, general",,,,"quick-fire, warm-up",funny-break,lifestyle,text,text,,,,,,,,,,,
Questions,Normal Game,"If you could invite three famous people to a dinner party, who would they be?",Celebrities,Text Answer,,,1,2,playful,lifestyle,"fun, random, hypothetical, lifestyle",,,,"quick-fire, warm-up",funny-break,lifestyle,text,text,,,,,,,,,,,
Questions,Normal Game,What upcoming celebrity biopic are you excited to watch?,Celebrities,Text Answer,,,1,2,playful,lifestyle,"fun, lifestyle, general",,,,"quick-fire, warm-up",funny-break,lifestyle,text,text,,,,,,,,,,,
Questions,Normal Game,What was your favorite cartoon as a child?,Childhood,Text Answer,,,1,3,playful,memories,"childhood, memories, fun, lifestyle",,,,"date-night, normal",deep-connection,memories,text,text,,,,,,,,,,,
Questions,Normal Game,What was your first pet’s name?,Childhood,Text Answer,,,1,2,playful,lifestyle,"fun, lifestyle, general",,,,"quick-fire, warm-up",funny-break,lifestyle,text,text,,,,,,,,,,,
Questions,Normal Game,Which childhood toy did you cherish the most?,Childhood,Text Answer,,,1,3,playful,memories,"childhood, memories, fun, lifestyle",,,,"date-night, normal",deep-connection,memories,text,text,,,,,,,,,,,
Questions,Normal Game,What is a food you refused to eat as a kid?,Childhood,Text Answer,,,1,3,playful,memories,"memories, food, lifestyle, childhood, drink",,,,"date-night, normal",deep-connection,memories,text,text,,,,,,,,,,,
Questions,Normal Game,Who was your childhood hero?,Childhood,Text Answer,,,1,3,playful,memories,"childhood, memories, fun, lifestyle",,,,"date-night, normal",deep-connection,memories,text,text,,,,,,,,,,,
Questions,Normal Game,What was your favorite school subject in elementary school?,Childhood,Text Answer,,,1,3,playful,memories,"childhood, memories, fun, lifestyle",,,,"date-night, normal",deep-connection,memories,text,text,,,,,,,,,,,
Questions,Normal Game,Did you have an imaginary friend growing up?,Childhood,Text Answer,,,1,2,playful,lifestyle,"fun, lifestyle, general",,,,"quick-fire, warm-up",funny-break,lifestyle,text,text,,,,,,,,,,,
Questions,Normal Game,What’s a funny family tradition from your childhood?,Childhood,Text Answer,,,1,3,playful,memories,"childhood, memories, fun, lifestyle",,,,"date-night, normal",deep-connection,memories,text,text,,,,,,,,,,,
Questions,Normal Game,Where did you go on your first family vacation?,Childhood,Text Answer,,,1,3,playful,memories,"memories, lifestyle, childhood, future, travel",,,,"date-night, normal",deep-connection,memories,text,text,,,,,,,,,,,
Questions,Normal Game,What was your favorite game to play with friends?,Childhood,Text Answer,,,1,2,competitive,lifestyle,"entertainment, sports, fun, lifestyle",,,,"quick-fire, warm-up",escalation,entertainment,text,text,,,,,,,,,,,
Questions,Normal Game,What was your least favorite chore as a child?,Childhood,Text Answer,,,1,3,playful,memories,"childhood, memories, fun, lifestyle",,,,"date-night, normal",deep-connection,memories,text,text,,,,,,,,,,,
Questions,Normal Game,Did you ever get in trouble for something you didn’t do?,Childhood,Text Answer,,,1,2,playful,lifestyle,"fun, lifestyle, general",,,,"quick-fire, warm-up",funny-break,lifestyle,text,text,,,,,,,,,,,
Questions,Normal Game,What’s the most embarrassing photo of you as a kid?,Childhood,Text Answer,,,1,3,awkward,memories,"childhood, memories, awkward, embarrassing",,,embarrassment-risk,"date-night, normal",deep-connection,memories,text,text,,,,,,,,,,,
Questions,Normal Game,Which relative were you closest to growing up?,Childhood,Text Answer,,,1,2,playful,lifestyle,"fun, lifestyle, general",,,,"quick-fire, warm-up",funny-break,lifestyle,text,text,,,,,,,,,,,
Questions,Normal Game,What was the best birthday party you had as a child?,Childhood,Text Answer,,,1,3,playful,memories,"childhood, memories, fun, lifestyle",,,,"date-night, normal",deep-connection,memories,text,text,,,,,,,,,,,
