Sheet,Game,Question,Category,Question Type,Options,Correct Answer,Active,Intensity,Tone,Relationship Area,Tags,Notes,Memory Lane Mode,Avoid If,Game Suitability,AI Use Case,Repeat Group,Default Answer Type,Answer Type,Unit Label,Scoring Divisor,Rounding Mode,Round Penalty Value,Fixed Penalty,Scoring Mode,Scoring Outcome Type,Source Label,Added By,Original Sheet,Original Question Type
Questions,Normal Game,"Rank these from most to least dangerous times: morning, bedtime, after drinks, after making up",Sexual,Sort Into Order,morning | bedtime | after drinks | after making up,,1,2,playful,lifestyle,"fun, lifestyle, general",,,,"quick-fire, warm-up",funny-break,lifestyle,ranked,ranked,,,,,,,,,,,
Questions,Normal Game,"Rank these from most to least likely to turn into sex: massage, shower, movie night, argument ending",Sexual,Sort Into Order,massage | shower | movie night | argument ending,,1,4,savage,sex,"entertainment, hot, fun, lifestyle, sex-life, savage, attraction, spicy",,,argument-risk,"spicy-night, final-round",spicy-escalation,bedroom-intimacy,ranked,ranked,,,,,,,,,,,
Questions,Normal Game,Open answer: what is the filthiest thing Jay could say that would still work?,Sexual,Text Answer,,,1,2,playful,lifestyle,"fun, lifestyle, general",,,,"quick-fire, warm-up",funny-break,lifestyle,text,text,,,,,,,,,,,
Questions,Normal Game,Open answer: what is the filthiest thing Kim could say that would still work?,Sexual,Text Answer,,,1,2,playful,lifestyle,"fun, lifestyle, general",,,,"quick-fire, warm-up",funny-break,lifestyle,text,text,,,,,,,,,,,
Questions,Normal Game,Open answer: what is Jay’s biggest sexual weakness?,Sexual,Text Answer,,,1,4,spicy,sex,"sex-life, hot, attraction, spicy",,,,"spicy-night, final-round",spicy-escalation,bedroom-intimacy,text,text,,,,,,,,,,,
Questions,Normal Game,Open answer: what is Kim’s biggest sexual weakness?,Sexual,Text Answer,,,1,4,spicy,sex,"sex-life, hot, attraction, spicy",,,,"spicy-night, final-round",spicy-escalation,bedroom-intimacy,text,text,,,,,,,,,,,
Questions,Normal Game,Open answer: what fantasy should be discussed properly?,Sexual,Text Answer,,,1,4,spicy,sex,"sex-life, hot, attraction, spicy",,,,"spicy-night, final-round",spicy-escalation,bedroom-intimacy,text,text,,,,,,,,,,,
Questions,Normal Game,Open answer: what should happen more often in the bedroom?,Sexual,Text Answer,,,1,2,playful,lifestyle,"fun, lifestyle, general",,,,"quick-fire, warm-up",funny-break,lifestyle,text,text,,,,,,,,,,,
Questions,Normal Game,Open answer: what should happen less often in the bedroom?,Sexual,Text Answer,,,1,2,playful,lifestyle,"fun, lifestyle, general",,,,"quick-fire, warm-up",funny-break,lifestyle,text,text,,,,,,,,,,,
Questions,Normal Game,Open answer: what would make Jay feel completely wanted?,Sexual,Text Answer,,,1,2,playful,lifestyle,"fun, lifestyle, general",,,,"quick-fire, warm-up",funny-break,lifestyle,text,text,,,,,,,,,,,
Questions,Normal Game,Open answer: what would make Kim feel completely wanted?,Sexual,Text Answer,,,1,2,playful,lifestyle,"fun, lifestyle, general",,,,"quick-fire, warm-up",funny-break,lifestyle,text,text,,,,,,,,,,,
Questions,Normal Game,Open answer: what is the best way to start sexual tension early in the day?,Sexual,Text Answer,,,1,4,spicy,sex,"sex-life, hot, attraction, spicy",,,,"spicy-night, final-round",spicy-escalation,bedroom-intimacy,text,text,,,,,,,,,,,
Questions,Normal Game,Open answer: what is the best naughty message to receive?,Sexual,Text Answer,,,1,2,playful,lifestyle,"fun, lifestyle, general",,,,"quick-fire, warm-up",funny-break,lifestyle,text,text,,,,,,,,,,,
Questions,Normal Game,Open answer: what is one thing you would try if embarrassment did not exist?,Sexual,Text Answer,,,1,2,playful,lifestyle,"fun, lifestyle, general",,,,"quick-fire, warm-up",funny-break,lifestyle,text,text,,,,,,,,,,,
Questions,Normal Game,Open answer: what is the hottest private rule you could make together?,Sexual,Text Answer,,,1,2,playful,lifestyle,"fun, lifestyle, general",,,,"quick-fire, warm-up",funny-break,lifestyle,text,text,,,,,,,,,,,
Questions,Normal Game,Open answer: what is the boldest bedroom dare you would actually do?,Sexual,Text Answer,,,1,2,playful,lifestyle,"fun, lifestyle, general",,,,"quick-fire, warm-up",funny-break,lifestyle,text,text,,,,,,,,,,,
Questions,Normal Game,Open answer: what is the safest kinky thing to try first?,Sexual,Text Answer,,,1,4,spicy,sex,"sex-life, hot, attraction, spicy",,,sexual-boundary,"spicy-night, final-round",spicy-escalation,bedroom-intimacy,text,text,,,,,,,,,,,
Questions,Normal Game,Open answer: what is the best compliment to hear during intimacy?,Sexual,Text Answer,,,1,2,playful,lifestyle,"fun, lifestyle, general",,,,"quick-fire, warm-up",funny-break,lifestyle,text,text,,,,,,,,,,,
Questions,Normal Game,Open answer: what is the most tempting way to be teased?,Sexual,Text Answer,,,1,2,playful,lifestyle,"fun, lifestyle, general",,,,"quick-fire, warm-up",funny-break,lifestyle,text,text,,,,,,,,,,,
Questions,Normal Game,Open answer: what is the one sentence that would instantly start trouble?,Sexual,Text Answer,,,1,2,playful,lifestyle,"fun, lifestyle, general",,,,"quick-fire, warm-up",funny-break,lifestyle,text,text,,,,,,,,,,,
Questions,Normal Game,Open answer: what is the sexiest thing Jay does outside the bedroom?,Sexual,Text Answer,,,1,4,spicy,sex,"sex-life, hot, attraction, spicy",,,,"spicy-night, final-round",spicy-escalation,bedroom-intimacy,text,text,,,,,,,,,,,
Questions,Normal Game,Open answer: what is the sexiest thing Kim does outside the bedroom?,Sexual,Text Answer,,,1,4,spicy,sex,"sex-life, hot, attraction, spicy",,,,"spicy-night, final-round",spicy-escalation,bedroom-intimacy,text,text,,,,,,,,,,,
Questions,Normal Game,Open answer: what is something naughty you should plan properly?,Sexual,Text Answer,,,1,2,playful,lifestyle,"fun, lifestyle, general",,,,"quick-fire, warm-up",funny-break,lifestyle,text,text,,,,,,,,,,,
Questions,Normal Game,Open answer: what is something naughty that should happen spontaneously?,Sexual,Text Answer,,,1,2,playful,lifestyle,"fun, lifestyle, general",,,,"quick-fire, warm-up",funny-break,lifestyle,text,text,,,,,,,,,,,
Questions,Normal Game,Open answer: what is the best sexual memory you want to make?,Sexual,Text Answer,,,1,4,spicy,sex,"sex-life, hot, attraction, spicy",,,,"spicy-night, final-round",spicy-escalation,bedroom-intimacy,text,text,,,,,,,,,,,
Questions,Normal Game,Open answer: what should your private signal for wanting sex be?,Sexual,Text Answer,,,1,4,spicy,sex,"sex-life, hot, attraction, spicy",,,,"spicy-night, final-round",spicy-escalation,bedroom-intimacy,text,text,,,,,,,,,,,
Questions,Normal Game,Open answer: what should the next naughty weekend include?,Sexual,Text Answer,,,1,2,playful,lifestyle,"fun, lifestyle, general",,,,"quick-fire, warm-up",funny-break,lifestyle,text,text,,,,,,,,,,,
Questions,Normal Game,Open answer: what is one thing Jay should be more confident about sexually?,Sexual,Text Answer,,,1,3,emotional,lifestyle,"confidence, emotional, fun, lifestyle",,,,"date-night, normal",deep-connection,confidence-risk,text,text,,,,,,,,,,,
Questions,Normal Game,Open answer: what is one thing Kim should be more confident about sexually?,Sexual,Text Answer,,,1,3,emotional,lifestyle,"confidence, emotional, fun, lifestyle",,,,"date-night, normal",deep-connection,confidence-risk,text,text,,,,,,,,,,,
Questions,Normal Game,Open answer: what is the hottest way to be kissed?,Sexual,Text Answer,,,1,2,playful,lifestyle,"fun, lifestyle, general",,,,"quick-fire, warm-up",funny-break,lifestyle,text,text,,,,,,,,,,,
Questions,Normal Game,Open answer: what is the hottest way to be touched?,Sexual,Text Answer,,,1,2,playful,lifestyle,"fun, lifestyle, general",,,,"quick-fire, warm-up",funny-break,lifestyle,text,text,,,,,,,,,,,
Questions,Normal Game,Open answer: what is the most dangerous place to start flirting?,Sexual,Text Answer,,,1,2,playful,future,"future, travel, lifestyle, fun",,,,"quick-fire, warm-up",funny-break,future-plans,text,text,,,,,,,,,,,
Questions,Normal Game,Open answer: what should never be said during sex?,Sexual,Text Answer,,,1,4,spicy,sex,"sex-life, hot, attraction, spicy",,,,"spicy-night, final-round",spicy-escalation,bedroom-intimacy,text,text,,,,,,,,,,,
Questions,Normal Game,Open answer: what should absolutely be said during sex?,Sexual,Text Answer,,,1,4,spicy,sex,"sex-life, hot, attraction, spicy",,,,"spicy-night, final-round",spicy-escalation,bedroom-intimacy,text,text,,,,,,,,,,,
Questions,Normal Game,Open answer: what would be the perfect naughty surprise?,Sexual,Text Answer,,,1,2,playful,lifestyle,"fun, lifestyle, general",,,,"quick-fire, warm-up",funny-break,lifestyle,text,text,,,,,,,,,,,
Questions,Normal Game,Open answer: what is the most tempting reward for winning?,Sexual,Text Answer,,,1,2,playful,lifestyle,"fun, lifestyle, general",,,,"quick-fire, warm-up",funny-break,lifestyle,text,text,,,,,,,,,,,
Questions,Normal Game,Open answer: what is the most tempting punishment for losing?,Sexual,Text Answer,,,1,2,playful,lifestyle,"fun, lifestyle, general",,,,"quick-fire, warm-up",funny-break,lifestyle,text,text,,,,,,,,,,,
Questions,Normal Game,Open answer: what is the best way to make the other beg for attention?,Sexual,Text Answer,,,1,2,playful,lifestyle,"fun, lifestyle, general",,,,"quick-fire, warm-up",funny-break,lifestyle,text,text,,,,,,,,,,,
Questions,Normal Game,Open answer: what is something Jay probably wants but has not said clearly?,Sexual,Text Answer,,,1,2,playful,lifestyle,"fun, lifestyle, general",,,,"quick-fire, warm-up",funny-break,lifestyle,text,text,,,,,,,,,,,
Questions,Normal Game,Open answer: what is something Kim probably wants but has not said clearly?,Sexual,Text Answer,,,1,2,playful,lifestyle,"fun, lifestyle, general",,,,"quick-fire, warm-up",funny-break,lifestyle,text,text,,,,,,,,,,,
Questions,Normal Game,Open answer: what is the most intimate thing that is not sex?,Sexual,Text Answer,,,1,4,spicy,sex,"sex-life, hot, attraction, spicy",,,,"spicy-night, final-round",spicy-escalation,bedroom-intimacy,text,text,,,,,,,,,,,
Questions,Normal Game,Open answer: what makes sex feel more connected?,Sexual,Text Answer,,,1,4,spicy,sex,"sex-life, hot, attraction, spicy",,,,"spicy-night, final-round",spicy-escalation,bedroom-intimacy,text,text,,,,,,,,,,,
Questions,Normal Game,Open answer: what makes sex feel more exciting?,Sexual,Text Answer,,,1,4,spicy,sex,"sex-life, hot, attraction, spicy",,,,"spicy-night, final-round",spicy-escalation,bedroom-intimacy,text,text,,,,,,,,,,,
Questions,Normal Game,Open answer: what is the line between teasing and being too much?,Sexual,Text Answer,,,1,2,playful,lifestyle,"fun, lifestyle, general",,,,"quick-fire, warm-up",funny-break,lifestyle,text,text,,,,,,,,,,,
Questions,Normal Game,Open answer: what should Jay and Kim try only when both are fully comfortable?,Sexual,Text Answer,,,1,2,playful,lifestyle,"fun, lifestyle, general",,,,"quick-fire, warm-up",funny-break,lifestyle,text,text,,,,,,,,,,,
Questions,Normal Game,Open answer: what is the hottest thing about being wanted by the other?,Sexual,Text Answer,,,1,2,playful,lifestyle,"fun, lifestyle, general",,,,"quick-fire, warm-up",funny-break,lifestyle,text,text,,,,,,,,,,,
Questions,Normal Game,Open answer: what is the funniest private sexual joke between you two?,Sexual,Text Answer,,,1,4,spicy,sex,"sex-life, hot, attraction, spicy",,,,"spicy-night, final-round",spicy-escalation,bedroom-intimacy,text,text,,,,,,,,,,,
Questions,Normal Game,Open answer: what would make the next date night end early?,Sexual,Text Answer,,,1,3,romantic,romance,"romantic, memories, future, fun",,,,"date-night, normal",romantic-moment,memories,text,text,,,,,,,,,,,
Questions,Normal Game,Open answer: what would make a lazy morning turn filthy?,Sexual,Text Answer,,,1,2,playful,lifestyle,"fun, lifestyle, general",,,,"quick-fire, warm-up",funny-break,lifestyle,text,text,,,,,,,,,,,
Questions,Normal Game,Open answer: what is the boldest thing either of you would actually admit?,Sexual,Text Answer,,,1,2,playful,lifestyle,"fun, lifestyle, general",,,,"quick-fire, warm-up",funny-break,lifestyle,text,text,,,,,,,,,,,
Questions,Normal Game,Open answer: what should the next spicy game unlock?,Sexual,Text Answer,,,1,2,competitive,lifestyle,"entertainment, sports, fun, lifestyle",,,,"quick-fire, warm-up",escalation,entertainment,text,text,,,,,,,,,,,
Questions,Normal Game,Finish the sentence: Jay gets turned on fastest when Kim...,Sexual,Text Answer,,,1,2,playful,lifestyle,"fun, lifestyle, general",,,,"quick-fire, warm-up",funny-break,lifestyle,text,text,,,,,,,,,,,
Questions,Normal Game,Finish the sentence: Kim gets turned on fastest when Jay...,Sexual,Text Answer,,,1,2,playful,lifestyle,"fun, lifestyle, general",,,,"quick-fire, warm-up",funny-break,lifestyle,text,text,,,,,,,,,,,
Questions,Normal Game,Finish the sentence: The riskiest place Jay and Kim have joked about doing it is...,Sexual,Text Answer,,,1,2,playful,future,"future, travel, lifestyle, fun",,,,"quick-fire, warm-up",funny-break,future-plans,text,text,,,,,,,,,,,
Questions,Normal Game,Finish the sentence: The sexiest thing Jay says is...,Sexual,Text Answer,,,1,4,spicy,sex,"sex-life, hot, attraction, spicy",,,,"spicy-night, final-round",spicy-escalation,bedroom-intimacy,text,text,,,,,,,,,,,
Questions,Normal Game,Finish the sentence: The sexiest thing Kim does is...,Sexual,Text Answer,,,1,4,spicy,sex,"sex-life, hot, attraction, spicy",,,,"spicy-night, final-round",spicy-escalation,bedroom-intimacy,text,text,,,,,,,,,,,
Questions,Normal Game,Finish the sentence: The bedroom rule Jay breaks most is...,Sexual,Text Answer,,,1,2,playful,lifestyle,"fun, lifestyle, general",,,,"quick-fire, warm-up",funny-break,lifestyle,text,text,,,,,,,,,,,
Questions,Normal Game,Finish the sentence: The bedroom rule Kim breaks most is...,Sexual,Text Answer,,,1,2,playful,lifestyle,"fun, lifestyle, general",,,,"quick-fire, warm-up",funny-break,lifestyle,text,text,,,,,,,,,,,
Questions,Normal Game,"Finish the sentence: If Jay wanted to tease Kim, he would...",Sexual,Text Answer,,,1,2,playful,lifestyle,"fun, lifestyle, general",,,,"quick-fire, warm-up",funny-break,lifestyle,text,text,,,,,,,,,,,
Questions,Normal Game,"Finish the sentence: If Kim wanted to tease Jay, she would...",Sexual,Text Answer,,,1,2,playful,lifestyle,"fun, lifestyle, general",,,,"quick-fire, warm-up",funny-break,lifestyle,text,text,,,,,,,,,,,
Questions,Normal Game,Finish the sentence: The easiest way to distract Jay sexually is...,Sexual,Text Answer,,,1,2,playful,lifestyle,"fun, lifestyle, general",,,,"quick-fire, warm-up",funny-break,lifestyle,text,text,,,,,,,,,,,
Questions,Normal Game,Finish the sentence: The easiest way to distract Kim sexually is...,Sexual,Text Answer,,,1,2,playful,lifestyle,"fun, lifestyle, general",,,,"quick-fire, warm-up",funny-break,lifestyle,text,text,,,,,,,,,,,
Questions,Normal Game,Finish the sentence: The most underrated turn-on between Jay and Kim is...,Sexual,Text Answer,,,1,4,spicy,sex,"sex-life, hot, attraction, spicy",,,,"spicy-night, final-round",spicy-escalation,bedroom-intimacy,text,text,,,,,,,,,,,
Questions,Normal Game,Finish the sentence: The thing Jay secretly wants more of is...,Sexual,Text Answer,,,1,2,playful,lifestyle,"fun, lifestyle, general",,,,"quick-fire, warm-up",funny-break,lifestyle,text,text,,,,,,,,,,,
Questions,Normal Game,Finish the sentence: The thing Kim secretly wants more of is...,Sexual,Text Answer,,,1,2,playful,lifestyle,"fun, lifestyle, general",,,,"quick-fire, warm-up",funny-break,lifestyle,text,text,,,,,,,,,,,
Questions,Normal Game,Finish the sentence: A perfect naughty night would start with...,Sexual,Text Answer,,,1,2,playful,lifestyle,"fun, lifestyle, general",,,,"quick-fire, warm-up",funny-break,lifestyle,text,text,,,,,,,,,,,
Questions,Normal Game,Finish the sentence: The biggest bedroom confidence boost is...,Sexual,Text Answer,,,1,3,emotional,lifestyle,"confidence, emotional, fun, lifestyle",,,,"date-night, normal",deep-connection,confidence-risk,text,text,,,,,,,,,,,
Questions,Normal Game,Finish the sentence: The look that means trouble is...,Sexual,Text Answer,,,1,2,playful,lifestyle,"fun, lifestyle, general",,,,"quick-fire, warm-up",funny-break,lifestyle,text,text,,,,,,,,,,,
Questions,Normal Game,Finish the sentence: The best place for a naughty weekend would be...,Sexual,Text Answer,,,1,2,playful,future,"future, travel, lifestyle, fun",,,,"quick-fire, warm-up",funny-break,future-plans,text,text,,,,,,,,,,,
Questions,Normal Game,Finish the sentence: The one thing that should happen more often is...,Sexual,Text Answer,,,1,2,playful,lifestyle,"fun, lifestyle, general",,,,"quick-fire, warm-up",funny-break,lifestyle,text,text,,,,,,,,,,,
Questions,Normal Game,Finish the sentence: Jay is most irresistible when he...,Sexual,Text Answer,,,1,2,playful,lifestyle,"fun, lifestyle, general",,,,"quick-fire, warm-up",funny-break,lifestyle,text,text,,,,,,,,,,,
Questions,Normal Game,Finish the sentence: Kim is most irresistible when she...,Sexual,Text Answer,,,1,2,playful,lifestyle,"fun, lifestyle, general",,,,"quick-fire, warm-up",funny-break,lifestyle,text,text,,,,,,,,,,,
Questions,Normal Game,Finish the sentence: The thing that makes cuddling dangerous is...,Sexual,Text Answer,,,1,2,playful,lifestyle,"fun, lifestyle, general",,,,"quick-fire, warm-up",funny-break,lifestyle,text,text,,,,,,,,,,,
Questions,Normal Game,Finish the sentence: The funniest thing that could happen during sex is...,Sexual,Text Answer,,,1,4,spicy,sex,"sex-life, hot, attraction, spicy",,,,"spicy-night, final-round",spicy-escalation,bedroom-intimacy,text,text,,,,,,,,,,,
Questions,Normal Game,Finish the sentence: The boldest thing one of you could suggest is...,Sexual,Text Answer,,,1,2,playful,lifestyle,"fun, lifestyle, general",,,,"quick-fire, warm-up",funny-break,lifestyle,text,text,,,,,,,,,,,
Questions,Normal Game,Finish the sentence: The safest word for getting attention would be...,Sexual,Text Answer,,,1,2,playful,lifestyle,"fun, lifestyle, general",,,,"quick-fire, warm-up",funny-break,lifestyle,text,text,,,,,,,,,,,
Questions,Normal Game,Finish the sentence: The sexiest compliment Jay could give Kim is...,Sexual,Text Answer,,,1,4,spicy,sex,"sex-life, hot, attraction, spicy",,,,"spicy-night, final-round",spicy-escalation,bedroom-intimacy,text,text,,,,,,,,,,,
Questions,Normal Game,Finish the sentence: The sexiest compliment Kim could give Jay is...,Sexual,Text Answer,,,1,4,spicy,sex,"sex-life, hot, attraction, spicy",,,,"spicy-night, final-round",spicy-escalation,bedroom-intimacy,text,text,,,,,,,,,,,
Questions,Normal Game,Finish the sentence: The thing that should stay private between you two is...,Sexual,Text Answer,,,1,2,playful,lifestyle,"fun, lifestyle, general",,,,"quick-fire, warm-up",funny-break,lifestyle,text,text,,,,,,,,,,,
Questions,Normal Game,Finish the sentence: The one fantasy worth talking about is...,Sexual,Text Answer,,,1,4,spicy,sex,"sex-life, hot, attraction, spicy",,,,"spicy-night, final-round",spicy-escalation,bedroom-intimacy,text,text,,,,,,,,,,,
Questions,Normal Game,"Finish the sentence: If the night was going to get naughty, the first sign would be...",Sexual,Text Answer,,,1,2,playful,lifestyle,"fun, lifestyle, general",,,,"quick-fire, warm-up",funny-break,lifestyle,text,text,,,,,,,,,,,
Questions,Normal Game,Rate from 1 to 10: how likely is Jay to start flirting first?,Sexual,Rating,1 | 2 | 3 | 4 | 5 | 6 | 7 | 8 | 9 | 10,,1,2,playful,lifestyle,"fun, lifestyle, general",,,,"quick-fire, warm-up",funny-break,lifestyle,number,number,,,,,,,,,,,
Questions,Normal Game,Rate from 1 to 10: how likely is Kim to tease Jay on purpose?,Sexual,Rating,1 | 2 | 3 | 4 | 5 | 6 | 7 | 8 | 9 | 10,,1,3,emotional,lifestyle,"emotional, deep, fun, lifestyle",,,,"date-night, normal",deep-connection,lifestyle,number,number,,,,,,,,,,,
Questions,Normal Game,Rate from 1 to 10: how adventurous are Jay and Kim together?,Sexual,Rating,1 | 2 | 3 | 4 | 5 | 6 | 7 | 8 | 9 | 10,,1,2,playful,lifestyle,"fun, lifestyle, general",,,,"quick-fire, warm-up",funny-break,lifestyle,number,number,,,,,,,,,,,
Questions,Normal Game,Rate from 1 to 10: how good is Jay at noticing when Kim is in the mood?,Sexual,Rating,1 | 2 | 3 | 4 | 5 | 6 | 7 | 8 | 9 | 10,,1,2,playful,lifestyle,"fun, lifestyle, general",,,,"quick-fire, warm-up",funny-break,lifestyle,number,number,,,,,,,,,,,
Questions,Normal Game,Rate from 1 to 10: how good is Kim at noticing when Jay is in the mood?,Sexual,Rating,1 | 2 | 3 | 4 | 5 | 6 | 7 | 8 | 9 | 10,,1,2,playful,lifestyle,"fun, lifestyle, general",,,,"quick-fire, warm-up",funny-break,lifestyle,number,number,,,,,,,,,,,
Questions,Normal Game,Rate from 1 to 10: how much does teasing work on Jay?,Sexual,Rating,1 | 2 | 3 | 4 | 5 | 6 | 7 | 8 | 9 | 10,,1,2,playful,lifestyle,"fun, lifestyle, general",,,,"quick-fire, warm-up",funny-break,lifestyle,number,number,,,,,,,,,,,
Questions,Normal Game,Rate from 1 to 10: how much does teasing work on Kim?,Sexual,Rating,1 | 2 | 3 | 4 | 5 | 6 | 7 | 8 | 9 | 10,,1,2,playful,lifestyle,"fun, lifestyle, general",,,,"quick-fire, warm-up",funny-break,lifestyle,number,number,,,,,,,,,,,
Questions,Normal Game,Rate from 1 to 10: how risky are Jay's messages?,Sexual,Rating,1 | 2 | 3 | 4 | 5 | 6 | 7 | 8 | 9 | 10,,1,2,playful,lifestyle,"fun, lifestyle, general",,,,"quick-fire, warm-up",funny-break,lifestyle,number,number,,,,,,,,,,,
Questions,Normal Game,Rate from 1 to 10: how risky are Kim's messages?,Sexual,Rating,1 | 2 | 3 | 4 | 5 | 6 | 7 | 8 | 9 | 10,,1,2,playful,lifestyle,"fun, lifestyle, general",,,,"quick-fire, warm-up",funny-break,lifestyle,number,number,,,,,,,,,,,
Questions,Normal Game,Rate from 1 to 10: how much do compliments matter in bed?,Sexual,Rating,1 | 2 | 3 | 4 | 5 | 6 | 7 | 8 | 9 | 10,,1,2,playful,lifestyle,"fun, lifestyle, general",,,,"quick-fire, warm-up",funny-break,lifestyle,number,number,,,,,,,,,,,
Questions,Normal Game,Rate from 1 to 10: how dominant is Jay?,Sexual,Rating,1 | 2 | 3 | 4 | 5 | 6 | 7 | 8 | 9 | 10,,1,2,playful,lifestyle,"fun, lifestyle, general",,,,"quick-fire, warm-up",funny-break,lifestyle,number,number,,,,,,,,,,,
Questions,Normal Game,Rate from 1 to 10: how much does confidence change the mood?,Sexual,Rating,1 | 2 | 3 | 4 | 5 | 6 | 7 | 8 | 9 | 10,,1,3,emotional,lifestyle,"confidence, emotional, fun, lifestyle",,,,"date-night, normal",deep-connection,confidence-risk,number,number,,,,,,,,,,,
Questions,Normal Game,Rate from 1 to 10: how strong is the chemistry after a good date night?,Sexual,Rating,1 | 2 | 3 | 4 | 5 | 6 | 7 | 8 | 9 | 10,,1,3,romantic,romance,"romantic, memories, future, fun",,,,"date-night, normal",romantic-moment,memories,number,number,,,,,,,,,,,
Questions,Normal Game,Rate from 1 to 10: how dangerous is late-night cuddling?,Sexual,Rating,1 | 2 | 3 | 4 | 5 | 6 | 7 | 8 | 9 | 10,,1,2,playful,lifestyle,"fun, lifestyle, general",,,,"quick-fire, warm-up",funny-break,lifestyle,number,number,,,,,,,,,,,
Questions,Normal Game,Rate from 1 to 10: how likely are Jay and Kim to try something new?,Sexual,Rating,1 | 2 | 3 | 4 | 5 | 6 | 7 | 8 | 9 | 10,,1,2,playful,lifestyle,"fun, lifestyle, general",,,,"quick-fire, warm-up",funny-break,lifestyle,number,number,,,,,,,,,,,
Questions,Normal Game,Rate from 1 to 10: how much does eye contact matter?,Sexual,Rating,1 | 2 | 3 | 4 | 5 | 6 | 7 | 8 | 9 | 10,,1,2,playful,lifestyle,"fun, lifestyle, general",,,,"quick-fire, warm-up",funny-break,lifestyle,number,number,,,,,,,,,,,
Questions,Normal Game,Rate from 1 to 10: how good is Jay at making Kim feel wanted?,Sexual,Rating,1 | 2 | 3 | 4 | 5 | 6 | 7 | 8 | 9 | 10,,1,2,playful,lifestyle,"fun, lifestyle, general",,,,"quick-fire, warm-up",funny-break,lifestyle,number,number,,,,,,,,,,,
Questions,Normal Game,Rate from 1 to 10: how good is Kim at making Jay feel wanted?,Sexual,Rating,1 | 2 | 3 | 4 | 5 | 6 | 7 | 8 | 9 | 10,,1,2,playful,lifestyle,"fun, lifestyle, general",,,,"quick-fire, warm-up",funny-break,lifestyle,number,number,,,,,,,,,,,
Questions,Normal Game,Rate from 1 to 10: how much does aftercare matter?,Sexual,Rating,1 | 2 | 3 | 4 | 5 | 6 | 7 | 8 | 9 | 10,,1,2,playful,lifestyle,"fun, lifestyle, general",,,,"quick-fire, warm-up",funny-break,lifestyle,number,number,,,,,,,,,,,
Questions,Normal Game,Rate from 1 to 10: how much does a slow build-up matter?,Sexual,Rating,1 | 2 | 3 | 4 | 5 | 6 | 7 | 8 | 9 | 10,,1,2,playful,lifestyle,"fun, lifestyle, general",,,,"quick-fire, warm-up",funny-break,lifestyle,number,number,,,,,,,,,,,
Questions,Normal Game,Rate from 1 to 10: how much does spontaneity matter?,Sexual,Rating,1 | 2 | 3 | 4 | 5 | 6 | 7 | 8 | 9 | 10,,1,2,playful,lifestyle,"fun, lifestyle, general",,,,"quick-fire, warm-up",funny-break,lifestyle,number,number,,,,,,,,,,,
Questions,Normal Game,Rate from 1 to 10: how likely is a normal joke to turn sexual?,Sexual,Rating,1 | 2 | 3 | 4 | 5 | 6 | 7 | 8 | 9 | 10,,1,4,spicy,sex,"sex-life, hot, attraction, spicy",,,,"spicy-night, final-round",spicy-escalation,bedroom-intimacy,number,number,,,,,,,,,,,
Questions,Normal Game,Rate from 1 to 10: how much should Jay and Kim talk about fantasies?,Sexual,Rating,1 | 2 | 3 | 4 | 5 | 6 | 7 | 8 | 9 | 10,,1,2,playful,lifestyle,"fun, lifestyle, general",,,,"quick-fire, warm-up",funny-break,lifestyle,number,number,,,,,,,,,,,
Questions,Normal Game,"Rank these from most to least tempting: kissing, teasing, cuddling, dirty talk",Sexual,Sort Into Order,kissing | teasing | cuddling | dirty talk,,1,4,spicy,sex,"sex-life, hot, attraction, spicy",,,,"spicy-night, final-round",spicy-escalation,bedroom-intimacy,ranked,ranked,,,,,,,,,,,
Questions,Normal Game,"Rank these from most to least likely to start intimacy: date night, argument making up, lazy morning, night out",Sexual,Sort Into Order,date night | argument making up | lazy morning | night out,,1,4,savage,romance,"romantic, savage, memories, future",,,argument-risk,"spicy-night, final-round",spicy-escalation,memories,ranked,ranked,,,,,,,,,,,
